{
  "$id": "https://trendmarketv2.local/schemas/boss_final.report.schema.json",
  "$schema": "http://json-schema.org/draft-07/schema#",
  "title": "Boss Final Local Report",
  "type": "object",
  "additionalProperties": false,
  "required": [
    "schema",
    "schema_version",
    "timestamp_utc",
    "status",
    "stages",
    "bundle"
  ],
  "properties": {
    "schema": {
      "type": "string",
      "const": "boss_final.report@v1"
    },
    "schema_version": {
      "type": "integer",
      "const": 1
    },
    "timestamp_utc": {
      "type": "string",
      "format": "date-time"
    },
    "status": {
      "type": "string",
      "enum": ["PASS", "FAIL"]
    },
    "bundle": {
      "type": "object",
      "additionalProperties": false,
      "required": ["sha256"],
      "properties": {
        "sha256": {
          "type": "string",
          "pattern": "^[0-9a-f]{64}$"
        }
      }
    },
    "stages": {
      "type": "array",
      "minItems": 1,
      "items": {
        "type": "object",
        "additionalProperties": false,
        "required": ["name", "status"],
        "properties": {
          "name": {
            "type": "string",
            "pattern": "^s[1-6]$"
          },
          "status": {
            "type": "string"
          },
          "errors": {
            "type": "array",
            "items": {
              "type": "string"
            }
          }
        }
      }
    }
  }
}
